{
  "project": "dependencia-del-dueno",
  "generatedBy": "skill motion-overlays v1.2.0",
  "canvas": { "width": 1920, "height": 1080, "fps": 30, "alpha": true },
  "style": "s-soft3d",
  "narration": { "language": "es", "wordsPerSecond": 2.6, "hasSubtitles": true },
  "overlays": [
    {
      "file": "01_semana_sin_ti.html",
      "duration": 5.40,
      "concept": "El negocio depende de una sola persona: sin ella, la semana se apaga.",
      "metaphor": "El mostrador sigue ahí, tú no; los 7 días dejan de funcionar en cascada.",
      "line": "¿Qué pasaría con tu negocio si mañana no pudieras trabajar durante una semana?",
      "cueIn":  { "word": "pasaría", "wordIndex": 2 },
      "cueOut": { "word": "semana", "wordIndex": 13, "tailSeconds": 0.6 },
      "beats": [
        { "t": 0.00, "label": "in",    "word": "pasaría" },
        { "t": 1.10, "label": "days",  "word": "negocio" },
        { "t": 2.00, "label": "gone",  "word": "mañana" },
        { "t": 3.10, "label": "dark",  "word": "durante" },
        { "t": 4.15, "label": "peak" },
        { "t": 4.85, "label": "exit" }
      ],
      "position": "pos-center",
      "safeToScale": true,
      "textOnScreen": ["7 DÍAS", "?"],
      "audit": { "emptyAtStart": true, "emptyAtEnd": true, "ok": true }
    },
    {
      "file": "02_cuello_de_botella.html",
      "duration": 5.88,
      "concept": "Cuatro operaciones dependen de una respuesta que no llega.",
      "metaphor": "Los flujos viajan al centro y se detienen a mitad de camino.",
      "line": "Si nadie puede comprar, pagar, resolver un reclamo o tomar una decisión hasta que tú respondas, tienes un problema de dependencia",
      "cueIn":  { "word": "puede", "wordIndex": 3 },
      "cueOut": { "word": "respondas", "wordIndex": 16, "tailSeconds": 0.5 },
      "beats": [
        { "t": 0.00, "label": "in",    "word": "puede" },
        { "t": 0.38, "label": "n1",    "word": "comprar" },
        { "t": 0.77, "label": "n2",    "word": "pagar" },
        { "t": 1.92, "label": "n3",    "word": "reclamo" },
        { "t": 3.30, "label": "n4",    "word": "decisión" },
        { "t": 4.30, "label": "pile",  "word": "hasta" },
        { "t": 4.90, "label": "block", "word": "respondas" },
        { "t": 5.40, "label": "exit" }
      ],
      "position": "pos-center",
      "safeToScale": true,
      "textOnScreen": ["S/"],
      "audit": { "emptyAtStart": true, "emptyAtEnd": true, "ok": true }
    },
    {
      "file": "03_lo_que_llega_hasta_ti.html",
      "duration": 4.20,
      "concept": "Identificar las cosas que suben hasta el dueño sin necesidad.",
      "metaphor": "Cuatro objetos suben en carriles paralelos a una bandeja y quedan marcados.",
      "line": "Empieza identificando qué cosas llegan innecesariamente hasta ti: descuentos pequeños, compras rutinarias, devoluciones o decisiones operativas.",
      "cueIn":  { "word": "ti", "wordIndex": 8 },
      "cueOut": { "word": "operativas", "wordIndex": 16, "tailSeconds": 0.45 },
      "beats": [
        { "t": 0.00, "label": "in",   "word": "ti" },
        { "t": 0.39, "label": "i1",   "word": "descuentos" },
        { "t": 1.16, "label": "i2",   "word": "compras" },
        { "t": 1.93, "label": "i3",   "word": "devoluciones" },
        { "t": 2.70, "label": "i4",   "word": "decisiones" },
        { "t": 3.15, "label": "mark" },
        { "t": 3.72, "label": "exit" }
      ],
      "position": "pos-center",
      "safeToScale": true,
      "textOnScreen": ["%"],
      "audit": { "emptyAtStart": true, "emptyAtEnd": true, "ok": true }
    },
    {
      "file": "04_limite_de_autoridad.html",
      "duration": 4.78,
      "concept": "Delegar es entregar autoridad hasta un límite explícito.",
      "metaphor": "Lo pequeño se resuelve bajo la raya; lo grande la toca y escala al dueño.",
      "line": "Después define qué puede decidir cada persona sin pedir permiso y hasta qué límite.",
      "cueIn":  { "word": "cada", "wordIndex": 6 },
      "cueOut": { "word": "límite", "wordIndex": 14, "tailSeconds": 0.6 },
      "beats": [
        { "t": 0.00, "label": "in",   "word": "cada" },
        { "t": 0.50, "label": "lim" },
        { "t": 0.95, "label": "s1",   "word": "sin" },
        { "t": 1.20, "label": "s2",   "word": "pedir" },
        { "t": 1.45, "label": "s3",   "word": "permiso" },
        { "t": 2.31, "label": "big",  "word": "hasta" },
        { "t": 2.90, "label": "hit",  "word": "límite" },
        { "t": 3.20, "label": "up" },
        { "t": 3.80, "label": "peak" },
        { "t": 4.30, "label": "exit" }
      ],
      "position": "pos-center",
      "safeToScale": true,
      "textOnScreen": ["LÍMITE"],
      "audit": { "emptyAtStart": true, "emptyAtEnd": true, "ok": true }
    },
    {
      "file": "05_del_celular_al_repositorio.html",
      "duration": 5.88,
      "concept": "La información crítica no puede vivir en un solo dispositivo.",
      "metaphor": "Tres cosas encerradas en un teléfono salen a un repositorio al que entra el equipo.",
      "line": "Documenta también los procesos importantes y asegúrate de que las cuentas, proveedores y archivos necesarios no existan solamente en tu celular.",
      "cueIn":  { "word": "las", "wordIndex": 10 },
      "cueOut": { "word": "celular", "wordIndex": 21, "tailSeconds": 0.6 },
      "beats": [
        { "t": 0.00, "label": "in",   "word": "las" },
        { "t": 0.39, "label": "i1",   "word": "cuentas" },
        { "t": 0.77, "label": "i2",   "word": "proveedores" },
        { "t": 1.54, "label": "i3",   "word": "archivos" },
        { "t": 3.08, "label": "lock", "word": "solamente" },
        { "t": 4.00, "label": "free", "word": "celular" },
        { "t": 5.05, "label": "team" },
        { "t": 5.42, "label": "exit" }
      ],
      "position": "pos-center",
      "safeToScale": true,
      "textOnScreen": [],
      "audit": { "emptyAtStart": true, "emptyAtEnd": true, "ok": true }
    },
    {
      "file": "06_dinero_mezclado.html",
      "duration": 5.89,
      "concept": "Mezclar caja del negocio y bolsillo personal hace que el saldo deje de significar algo.",
      "metaphor": "Monedas que salen de la caja hacia una billetera; el display acaba en S/ ?.",
      "line": "Hoy entran quinientos soles, sacas cien para una compra personal; mañana otros cincuenta…",
      "lineSource": "Ejemplo del brief, NO pertenece al guion de siete frases. Reajustar los beats si la locución real difiere.",
      "cueIn":  { "word": "Hoy", "wordIndex": 1 },
      "cueOut": { "word": "cincuenta", "wordIndex": 13, "tailSeconds": 0.6 },
      "beats": [
        { "t": 0.00, "label": "in",   "word": "Hoy" },
        { "t": 0.77, "label": "cash", "word": "quinientos" },
        { "t": 1.92, "label": "out1", "word": "cien" },
        { "t": 2.31, "label": "hold", "word": "para", "hold": true },
        { "t": 3.85, "label": "out2", "word": "mañana" },
        { "t": 4.85, "label": "blur" },
        { "t": 5.45, "label": "exit" }
      ],
      "position": "pos-center",
      "safeToScale": true,
      "textOnScreen": ["NEGOCIO", "PERSONAL", "S/500", "+S/500", "−S/100", "−S/50", "S/ ?"],
      "audit": { "emptyAtStart": true, "emptyAtEnd": true, "ok": true }
    }
  ],
  "skipped": [
    {
      "line": "Delegar no es decir 'encárgate'; también es entregar autoridad",
      "reason": "Remate hablado de la frase 4; el overlay 04 ya ocupa su primera mitad y sale antes para dejar el cierre al presentador."
    },
    {
      "line": "El objetivo no es desaparecer del negocio. Es conseguir que tu tiempo se utilice en decisiones importantes y no en resolver cada pequeño problema.",
      "reason": "Idea de intención, sin objeto que mostrar. Funciona mejor a cámara."
    },
    {
      "line": "Haz la prueba: imagina que mañana faltas siete días. ¿Qué sería lo primero que dejaría de funcionar?",
      "reason": "Pregunta directa al espectador; los 7 días ya son la metáfora del overlay 01 y repetirla restaría fuerza al remate."
    }
  ],
  "render": {
    "captureUrl": "<file>?paused=1&t=<segundo>",
    "chromeFlags": "--headless=new --disable-gpu --hide-scrollbars --default-background-color=00000000 --window-size=1920,1080",
    "recommendedCodec": "prores_ks profile 4444 pix_fmt yuva444p10le",
    "fallback": "?bg=green + chroma key en el editor"
  }
}
